{
  "receipt_version": "srs.core.v5.1",
  "receipt_id": "provenance-minimal-0001",
  "receipt_type": "provenance",
  "boundary_type": "provenance_boundary",
  "protocol_binding": "arcs-srs",
  "subject_ref": "fixture:provenance-minimal",
  "issued_at": "2026-01-01T00:00:00Z",
  "artifact_classes_covered": [
    "provenance"
  ],
  "artifact_classes_excluded": [
    "truth_verification"
  ],
  "attestation_limits": [
    "this receipt attests envelope shape only, not body truth"
  ],
  "extensions": {}
}
