{
  "artifact_classes_covered": [
    "trace",
    "provenance"
  ],
  "artifact_classes_excluded": [
    "truth_verification",
    "authorization_grant",
    "admission_decision"
  ],
  "attestation_limits": [
    "this receipt attests SRS envelope shape and input-byte integrity only",
    "it does not assert that the subject receipt (subject_ref) is valid",
    "it does not assert that any action described by the subject receipt was authorized",
    "it does not assert that the witness observation/result is true",
    "witness_offer_exists != witness_selected != receipt_observed != receipt_valid != action_authorized != result_true",
    "witness count never substitutes for verification or admission"
  ],
  "boundary_type": "witness_market_boundary",
  "extensions": {
    "garp": {
      "body": {
        "artifact_hashes": {
          "input/witness_market.input.json": "sha256:33eb57c4af9878a22988982bcf9aba190fd21e142f1ea8d6d54da4603e688427"
        },
        "body_kind": "witness_market_transaction",
        "invariant_chain": [
          "witness_offer_exists",
          "witness_selected",
          "receipt_observed",
          "receipt_valid",
          "action_authorized",
          "result_true"
        ],
        "offer": {
          "guarantees": [
            "exact_bytes",
            "observed_at"
          ],
          "offer_id": "witness-service-offer:05955aa7df0c8e8e558161167b32d28ef0244110f8149d4f512496d54fd82e90",
          "profile_ref": "profile:srs-envelope-v0.1.0",
          "provider_node_id": "node:witness-alpha",
          "service_kind": "receipt_witness"
        },
        "request": {
          "receipt_digest": "sha256:5d5579730f2db5b70fd74bc1a2f501995816adb115ccf445d9a775e50b12f334",
          "request_id": "witness-request:03afbebe0429bd9ce4e4ed200e503622e37b9b4973fdf1d67d16f513bafc41e3",
          "requested_service": "receipt_witness",
          "service_offer_id": "witness-service-offer:05955aa7df0c8e8e558161167b32d28ef0244110f8149d4f512496d54fd82e90"
        },
        "result": {
          "native_artifact_ref": "witness-observation://node:witness-alpha/0001",
          "request_id": "witness-request:03afbebe0429bd9ce4e4ed200e503622e37b9b4973fdf1d67d16f513bafc41e3",
          "status": "OBSERVED"
        }
      }
    }
  },
  "issued_at": "2026-08-23T00:00:00Z",
  "protocol_binding": "garp",
  "receipt_id": "witness-market-33eb57c4af9878a2",
  "receipt_type": "provenance",
  "receipt_version": "srs.core.v5.1",
  "subject_ref": "sha256:5d5579730f2db5b70fd74bc1a2f501995816adb115ccf445d9a775e50b12f334"
}
